{
  "$schema": "https://observability-placement.local/contracts/optimization-goal.schema.json",
  "schemaVersion": 1,
  "id": "teastore-auth-persistence-fault-v1",
  "status": "frozen-for-structural-oracle",
  "operationalFreezeStatus": "open",
  "module": "teastore",
  "applicationFamily": "teastore",
  "catalogBinding": {
    "path": "modules/teastore/activation/catalog.json",
    "id": "teastore-kieker-34b37f7",
    "sha256": "062fc23b515fd7914f5169b25b6f85c9e2cae0b24afa20327c53866a86f43688"
  },
  "compatibleContextIds": ["teastore-compose-kieker-srv5-v1"],
  "scenario": {
    "id": "auth-freeze",
    "workloadPopulation": "fixed-open-loop full TeaStore journey",
    "intervention": "bounded auth container pause with proven recovery",
    "informationRole": "training"
  },
  "evidenceRequirements": {
    "required": ["operation:auth", "operation:persistence"],
    "optional": ["propagation:registry-client"],
    "requiredRelations": ["auth->persistence"]
  },
  "structuralObjectives": [
    {"id": "required-evidence-coverage", "direction": "maximize"},
    {"id": "structural-required-set-covered", "direction": "maximize"},
    {"id": "structural-activation-count", "direction": "minimize"}
  ],
  "empiricalObjectives": [
    {"id": "required_sensor_retention", "direction": "maximize", "requiredWindow": "fault-utility"},
    {"id": "required_edge_retention", "direction": "maximize", "requiredWindow": "fault-utility"},
    {"id": "application_cpu_seconds_per_success", "direction": "minimize", "requiredWindow": "no-fault-cost"}
  ],
  "claimBoundary": "This structural goal skeleton is frozen only for catalog enumeration; its operational workload, intervention, SLO, timing, utility, and measurement freeze remains open. The oracle can identify catalog-admissible structural assignments declaring the required operation sensors. Only a proven fault run can establish retained evidence or diagnostic utility."
}
